{
  "id": "microinteractions",
  "order": 17,
  "title": {
    "en": "Microinteractions",
    "ar": "التفاعلات الدقيقة"
  },
  "intro": {
    "en": "Microinteractions transform an interface from merely functional to delightfully memorable. Master trigger-response feedback, natural easing curves, time budgets, and production performance restraint.",
    "ar": "تحول التفاعلات الدقيقة الواجهة من مجرد واجهة وظيفية إلى واجهة لا تُنسى ومبهجة. أتقن التغذية الراجعة للاستجابة للمحفزات، ومنحنيات التخفيف (Easing curves) الطبيعية، والميزانيات الزمنية، وقيود أداء الإنتاج."
  },
  "sections": [
    {
      "id": "animation-vs-microinteraction",
      "title": {
        "en": "Animation vs. Microinteraction",
        "ar": "الفرق بين الأنيميشن والتفاعل الدقيق"
      },
      "body": {
        "en": "While any shift in geometry or opacity over time qualifies as an animation, a **microinteraction** is a distinct subset:\n\n**A microinteraction is a responsive animation that occurs as the direct, immediate consequence of a conscious user action.**\n\nPassive looping decorative backgrounds are animations; a toggle switch springing to the active state or a heart icon bursting with particle color upon tap is a microinteraction.",
        "ar": "في حين أن أي تحول في الهندسة أو العتامة (Opacity) بمرور الوقت يُعد رسومًا متحركة (Animation)، فإن التفاعل الدقيق (Microinteraction) هو مجموعة فرعية متميزة:\n\n**التفاعل الدقيق هو رسوم متحركة متجاوبة تحدث كنتيجة مباشرة وفورية لإجراء واعي من قبل المستخدم.**\n\nالخلفيات الزخرفية السلبية المتكررة هي رسوم متحركة؛ في حين أن مفتاح التبديل الذي يقفز إلى الحالة النشطة، أو أيقونة القلب التي تنفجر بلون جزيئي عند النقر، هي تفاعلات دقيقة."
      }
    },
    {
      "id": "the-feedback-imperative",
      "title": {
        "en": "Instant Tactile Feedback",
        "ar": "التغذية الراجعة الفورية"
      },
      "body": {
        "en": "The primary role of every microinteraction is **feedback**. In digital products, users lack physical physical tactile clicks. A microinteraction provides digital haptics, reassuring the user that their request was successfully recognized.\n\n**The Golden Rule:** Keep microinteractions lightning fast. They should add delight without delaying user progress. Keep duration **strictly under 300–400ms** for simple controls.",
        "ar": "الدور الأساسي لكل تفاعل دقيق هو التغذية الراجعة (Feedback). في المنتجات الرقمية، يفتقر المستخدمون إلى النقرات اللمسية المادية. يوفر التفاعل الدقيق لمسات رقمية (Digital haptics)، مما يطمئن المستخدم إلى أنه تم التعرف على طلبه بنجاح.\n\n**القاعدة الذهبية:** اجعل التفاعلات الدقيقة سريعة كالبرق. يجب أن تضيف البهجة دون تأخير تقدم المستخدم. حافظ على المدة أقل من 300-400 مللي ثانية لعناصر التحكم البسيطة."
      },
      "callout": {
        "type": "tip",
        "en": "Keep microinteraction transitions between 200ms and 400ms. Motion should feel instantaneous, never sluggish.",
        "ar": "احرص على ألا تزيد مدة التفاعلات الدقيقة عن 200 إلى 400 مللي ثانية؛ يجب أن تبدو الاستجابة فورية بدون إبطاء."
      },
      "asset": {
        "file": "microinteraction-feedback.png",
        "alt": {
          "en": "Three-stage microinteraction feedback cycle: resting, pressed, and confirmed state",
          "ar": "دورة استجابة التفاعل الدقيق في ثلاث مراحل: السكون، الضغط، والتأكيد"
        },
        "ratio": "16:9",
        "brief": "Sequential 3-frame animation storyboard for a \"Save to Bookmark\" button: Frame 1 resting outline icon; Frame 2 finger press causing scale(0.96) compression and blue radial highlight; Frame 3 smooth transition to filled bookmark icon with tiny particle burst confirming success."
      }
    },
    {
      "id": "easing-curves",
      "title": {
        "en": "Easing Curves: Linear vs. Natural Acceleration",
        "ar": "منحنيات الحركة: الخطي مقابل الطبيعي"
      },
      "body": {
        "en": "Physics dictates that objects in the real world never move at constant speed:\n\n- **Linear:** Constant speed from start to end. Appears robotic, rigid, and deeply unnatural.\n- **Ease-In:** Starts sluggishly and accelerates. Ideal for elements exiting the screen.\n- **Ease-Out:** Starts with high velocity and cushions to a gentle stop. **The gold standard for UI elements entering the viewport**.\n- **Ease-In-Out / Spring:** Accelerates and decelerates organically, mimicking real-world inertia.",
        "ar": "تُملي الفيزياء أن الأجسام في العالم الحقيقي لا تتحرك أبدًا بسرعة ثابتة:\n\n- **خطي (Linear):** سرعة ثابتة من البداية إلى النهاية. يظهر آليًا وصلبًا وغير طبيعي بعمق.\n- **دخول مرن (Ease-In):** يبدأ ببطء ويتسارع. مثالي للعناصر التي تخرج من الشاشة.\n- **خروج مرن (Ease-Out):** يبدأ بسرعة عالية ويتوقف ببطء. المعيار الذهبي لعناصر واجهة المستخدم التي تدخل إلى إطار العرض (Viewport).\n- **دخول وخروج مرن / زنبرك (Ease-In-Out / Spring):** يتسارع ويتباطأ بشكل عضوي، محاكيًا القصور الذاتي (Inertia) في العالم الحقيقي."
      },
      "asset": {
        "file": "easing-curves.png",
        "alt": {
          "en": "Comparison graph of Linear, Ease-In, Ease-Out, and Cubic-Bezier easing curves",
          "ar": "رسم بياني لمقارنة منحنيات التخفيف الخطية (Linear)، والدخول المرن (Ease-In)، والخروج المرن (Ease-Out)، ومنحنيات بيزييه المكعبة (Cubic-Bezier)"
        },
        "ratio": "16:9",
        "brief": "A graph comparing four velocity curves: flat Linear slope, upward curving Ease-In, cushioned Ease-Out curve, and organic Spring curve."
      }
    },
    {
      "id": "practical-examples",
      "title": {
        "en": "Signature Microinteraction Touchpoints",
        "ar": "أمثلة عملية للتفاعلات الدقيقة"
      },
      "body": {
        "en": "Everyday microinteractions that elevate products:\n- **Button Press Compression:** Shrinking a button to `scale(0.97)` on active press and rebounding.\n- **Favorite / Like Toggles:** A quick scale pulse and color fill.\n- **Skeleton Shimmer Screens:** Reassuring shimmer bars that confirm background content loading.\n- **Navbar Active Transitions:** Gliding pill highlight following active tab selection.",
        "ar": "تفاعلات دقيقة يومية ترتقي بالمنتجات:\n- **انضغاط الضغط على الزر:** تقليص زر إلى `scale(0.97)` عند الضغط النشط ثم ارتداده.\n- **مفاتيح التبديل المفضلة / الإعجاب:** نبض مقياس سريع وملء لون.\n- **شاشات الوميض الهيكلية (Skeleton Shimmer Screens):** أشرطة وميض مطمئنة تؤكد تحميل محتوى الخلفية.\n- **الانتقالات النشطة لشريط التنقل:** إبراز انزلاقي يتبع تحديد علامة التبويب النشطة."
      }
    },
    {
      "id": "avoid-dribbble-traps",
      "title": {
        "en": "Avoiding the Dribbble Animation Trap",
        "ar": "فخ استعراضات Dribbble غير العملية"
      },
      "body": {
        "en": "The extravagant, slow-motion 3D transformations popular on social design portfolios are almost always toxic in real production apps. Heavy animations drain mobile batteries, trigger device lag, and obstruct user task completion.\n\nPrioritize raw performance, lightweight CSS transitions, and swift responsiveness over superficial pyrotechnics.",
        "ar": "التحويلات ثلاثية الأبعاد الفاخرة والبطيئة الحركة الشائعة في محافظ التصميم الاجتماعي تكون دائمًا سامة في تطبيقات الإنتاج الحقيقية. فالرسوم المتحركة الثقيلة تستنزف بطاريات الأجهزة المحمولة، وتتسبب في تأخر الجهاز، وتعيق إنجاز المستخدم لمهمته.\n\nأعطِ الأولوية للأداء الخام، وانتقالات CSS خفيفة الوزن، والاستجابة السريعة على الألعاب النارية السطحية."
      },
      "callout": {
        "type": "warning",
        "en": "Never sacrifice app speed for flashy animation. Users will abandon slow interfaces no matter how pretty the motion is.",
        "ar": "لا تضحي أبداً بسرعة واستجابة التطبيق مقابل حركات بهلوانية؛ المستخدم سيغادر أي تطبيق بطيء مهما كان شكله مبهراً."
      },
      "asset": {
        "file": "dribbble-vs-production-motion.png",
        "alt": {
          "en": "Production-ready 180ms ease-out motion versus flashy slow Dribbble concept animation",
          "ar": "الحركة الإنتاجية السريعة 180ms مقابل حركات الاستعراض البطيئة المزعجة للمستخدم"
        },
        "ratio": "16:9",
        "brief": "Timeline comparison: Top shows a 2.5-second flashy social media concept animation with spinning icons and excessive bounce (slow, nauseating); Bottom shows a production-grade 140ms ease-out dropdown menu opening (instant, snappy, purposeful)."
      }
    }
  ]
}
