{
  "id": "design-process",
  "order": 19,
  "title": {
    "en": "My UI Design Process",
    "ar": "عملية التصميم"
  },
  "intro": {
    "en": "A transparent walkthrough of an end-to-end product design workflow from deep discovery and rapid ugly sketches to wireframing, token assembly, and client presentation.",
    "ar": "رحلة عمل متكاملة وشاملة لمصمم واجهات محترف من أول فهم المشكلة الحقيقية والاسكتشات السريعة، لحد الوايرفريمز واختيار الأصول وفن عرض التصميم على العميل."
  },
  "sections": [
    {
      "id": "understand-the-problem",
      "title": {
        "en": "Step 1: Deep Problem Discovery",
        "ar": "الخطوة ١: افهم المشكلة الحقيقية"
      },
      "body": {
        "en": "This is the single most critical phase of product design. You can build the most visually breathtaking interface on earth, but if it solves the wrong problem — or solves a non-existent problem — it is fundamentally worthless.\n\nFreelance clients often believe hiring a UI designer just means \"making it look modern\". You must champion UX discovery: interviewing stakeholders, mapping core user flows, and defining true success metrics before opening your design canvas.",
        "ar": "دي أهم خطوة على الإطلاق في دورة حياة أي منتج. ممكن تصمم أحلى واجهة شافتهم عين في العالم، لكن لو بتحل المشكلة الغلط أو المستخدمين مش محتاجينها، قيمتها الحقيقية صفر.\n\nالعملاء في الغالب بيفكروا إن مصمم الواجهات شغلته \"يجمّل الشكل وبس\". دورك كمحترف إنك تغوص في بحث تجربة المستخدم، تفهم رحلة المستخدم، وتحدد المشكلة بدقة قبل ما تلمس أي زرار تصميم."
      },
      "callout": {
        "type": "quote",
        "en": "Good UX is the indispensable foundation of good UI. A gorgeous screen that solves the wrong problem is a failure.",
        "ar": "تجربة المستخدم السليمة هي الأساس الحقيقي لأي واجهة؛ الواجهة المبهرة التي تحل مشكلة وهمية هي تصميم فاشل."
      }
    },
    {
      "id": "ugly-rapid-sketches",
      "title": {
        "en": "Step 2: Rapid Ugly Paper Sketches",
        "ar": "الخطوة ٢: الاسكتشات السريعة"
      },
      "body": {
        "en": "The goal of early ideation is transferring concepts from your brain onto paper as quickly and cheaply as possible.\n\n**The Rule:** Quantity trumps beauty. Ten rough, messy sketches exploring distinct layout structures are infinitely more valuable than one polished drawing. Do not think about fonts, colors, or shadows. Uncoupling structural exploration from visual styling liberates rapid experimentation.",
        "ar": "الهدف هنا إنك تفرّغ الأفكار من دماغك على الورق بأسرع وأرخص طريقة ممكنة.\n\n**القاعدة الأساسية: الكمية أهم من الجمال في المرحلة دي.** ١٠ رسومات سريعة وخشنة بتستكشف ١٠ طرق مختلفة لحل الشاشة أحسن بكتير من رسمة واحدة متزوقة. افصل التفكير في الهيكل تماماً عن التفكير في الخطوط والألوان."
      }
    },
    {
      "id": "structural-wireframes",
      "title": {
        "en": "Step 3: Structural Wireframing",
        "ar": "الخطوة ٣: الهيكل التخطيطي (Wireframes)"
      },
      "body": {
        "en": "Translate your strongest paper concepts into digital low-fidelity wireframes in Figma. Wireframes represent the foundational agreement point between you and the client.\n\nReviewing wireframes in greyscale ensures stakeholders focus exclusively on content placement, navigation hierarchy, and user journey flow before getting distracted by personal color debates.",
        "ar": "حوّل أفضل الاسكتشات الورقية لهياكل رقمية سريعة (Wireframes) بالأبيض والأسود في فيجما. الوايرفريم هو نقطة الاتفاق والوضوح المشترك بينك وبين العميل.\n\nمراجعة الهيكل بدون ألوان بتجبر العميل يركز على تدفق الرحلة، سهولة التصفح، وأماكن المعلومات المهمة، بعيداً عن الجدل العاطفي في الألوان."
      },
      "asset": {
        "file": "wireframe-to-ui.png",
        "alt": {
          "en": "Progression from rough sketch to wireframe to high fidelity UI",
          "ar": "مراحل تطور التصميم: من اسكتش ورقي إلى وايرفريم ثم واجهة نهائية"
        },
        "ratio": "16:9",
        "brief": "Three frames side-by-side: a hand-drawn napkin sketch on the left, a clean greyscale wireframe in the center, and the finished high-fidelity colored UI on the right."
      }
    },
    {
      "id": "asset-selection-after-layout",
      "title": {
        "en": "Step 4: Asset Selection (Type, Color, Icons)",
        "ar": "الخطوة ٤: اختيار الأصول البصرية"
      },
      "body": {
        "en": "Only after the wireframe structure is locked should you choose your design tokens: font pairings, color palettes, icon weights, and component styling.\n\nLocking design tokens in collaboration with the client prevents endless revisions later. Once the typography scale and color system are ratified, applying them to the validated wireframe flows smoothly and predictably.",
        "ar": "بعد ما الهيكل والوايرفريم يتثبت ويتوافق عليه، تبدأ مرحلة اختيار الأصول البصرية: الخطوط، باليتة الألوان، وحزمة الأيقونات.\n\nالاتفاق على الهوية البصرية مع العميل قبل البدء في تلوين الشاشات بيمنع أي سوء تفاهم لاحق. تطبيق الأصول على هيكل جاهز ومدروس بيخلي مرحلة الإنتاج سلسة جداً."
      }
    },
    {
      "id": "presentation-and-rationale",
      "title": {
        "en": "Step 5 & 6: Assembly & The Art of Client Presentation",
        "ar": "الخطوة ٥ و٦: التجميع وفن عرض التصميم"
      },
      "body": {
        "en": "Never send raw Figma links or silent export zip files to a client. Clients lack your domain training and will evaluate work purely on subjective whims.\n\n**Present via Live Walkthrough or Loom Video:** Walk through your screens systematically, articulating **why** each design choice was made, which user problems it solves, and how it drives business objectives. Explaining your rationale cuts revision cycles in half and establishes you as an authoritative strategic partner.",
        "ar": "إياك تبعت لينكات فيجما أو ملفات صور صامتة في إيميل وتقول للعميل \"شوف وقولي رأيك\". العميل مش متخصص ودايمًا هيحكم بذوقه الشخصي السطحي.\n\n**اعرض الشغل في مكالمة أو فيديو Loom مسجل:** اشرح الشاشات خطوة بخطوة ووضّح **ليه** أخدت كل قرار، وازاي التصميم ده بيخدم أهداف البيزنس ويسهل حياة المستخدم. شرح الأسباب بيختصر 50% من طلبات التعديل العشوائية ويرسخ مكانتك كمستشار خبير مش مجرد رسام."
      },
      "callout": {
        "type": "tip",
        "en": "Never deliver designs without explaining the strategic rationale behind key decisions. Walking clients through solutions prevents random feedback loops.",
        "ar": "لا تسلم ملفات التصميم بدون شرح منطق القرارات؛ تقديم الأسباب الاستراتيجية يحمي التصميم من طلبات التعديل غير المدروسة."
      }
    }
  ]
}