{
  "id": "ending",
  "order": 21,
  "title": {
    "en": "Ending & Looking Forward",
    "ar": "الخاتمة والانطلاق"
  },
  "intro": {
    "en": "Congratulations on finishing the complete curriculum. UI design is a lifelong, evolving craft. Carry these principles into your daily work and help build the future of the Arabic digital experience.",
    "ar": "تهانينا على إنهاء المنهج الكامل. تصميم واجهة المستخدم حرفة تتطور مدى الحياة. احمل هذه المبادئ في عملك اليومي وساعد في بناء مستقبل التجربة الرقمية العربية."
  },
  "sections": [
    {
      "id": "a-living-body-of-knowledge",
      "title": {
        "en": "A Living, Evolving Craft",
        "ar": "علم حي ومستمر في التطور"
      },
      "body": {
        "en": "Congratulations on completing this comprehensive masterclass. The principles documented here are not fleeting fads — they represent decades of established human-computer interaction patterns, visual psychology, and ergonomic standards.\n\nThis reference site is engineered as a living document: as frameworks, responsive form factors, and spatial platforms evolve, this reference will continue to update with modern expansions.",
        "ar": "تهانينا على إكمال هذا الفصل الدراسي الشامل. المبادئ الموثقة هنا ليست بدعًا عابرة — إنها تمثل عقودًا من أنماط التفاعل بين الإنسان والحاسوب الراسخة وعلم النفس البصري والمعايير المريحة.\n\nتم تصميم هذا الموقع المرجعي كوثيقة حية: مع تطور أطر العمل وعوامل الشكل سريعة الاستجابة والمنصات المكانية، سيستمر هذا المرجع في التحديث بالتوسعات الحديثة."
      }
    },
    {
      "id": "theory-vs-daily-craft",
      "title": {
        "en": "Theory vs. Daily Craft",
        "ar": "النظرية مقابل الممارسة اليومية"
      },
      "body": {
        "en": "What separates an amateur who knows the rules from a master designer is deliberate, daily application.\n\n> **\"What truly defines you as a designer is not that you have memorized the principles, but that you apply them every single day slightly better than the day before.\"**\n\nSeek out new design challenges, embrace code constraints, participate in design critique, and test your work relentlessly with real humans.",
        "ar": "ما يفصل الهاوي الذي يعرف القواعد عن المصمم المحترف هو التطبيق المتعمد واليومي.\n\n> **\"ما يميزك حقًا كمصمم ليس حفظ المبادئ، بل تطبيقها كل يوم بشكل أفضل قليلاً من اليوم السابق.\"**\n\nابحث عن تحديات تصميم جديدة، وتقبل قيود التعليمات البرمجية، وشارك في النقد التصميمي، واختبر عملك بلا هوادة مع بشر حقيقيين."
      },
      "callout": {
        "type": "quote",
        "en": "What truly defines you as a designer is applying these foundational principles every single day better than the day before.",
        "ar": "ما يميزك حقاً كمصمم هو تطبيق هذه المبادئ في ممارستك اليومية بشكل أفضل في كل مرة."
      },
      "asset": {
        "file": "theory-into-daily-craft.png",
        "alt": {
          "en": "The continuous UI design mastery loop: observe, deconstruct, recreate, and ship",
          "ar": "حلقة إتقان التصميم المستمرة: الملاحظة، التفكيك والتحليل، إعادة البناء، ثم الإطلاق"
        },
        "ratio": "16:9",
        "brief": "Circular flywheel diagram showing the 4-step daily design habit: (1) Observe real top-tier apps (Mobbin/App Store) → (2) Deconstruct mathematical rules (grid, typography scale, tokens) → (3) Rebuild pixel-for-pixel in Figma → (4) Ship production code."
      }
    },
    {
      "id": "building-the-arabic-design-community",
      "title": {
        "en": "Building the Arabic Design Community",
        "ar": "بناء مجتمع التصميم العربي"
      },
      "body": {
        "en": "The Arabic digital ecosystem is undergoing a historic transformation. More than 400 million Arabic speakers deserve digital experiences tailored natively to their language, rich heritage, and cultural nuances — not crude, flipped machine translations.\n\nBy designing with deep respect for Arabic typography, natural RTL ergonomics, and cultural semantics, you aren't just shipping code — you are actively authoring the future of the Arabic digital world.",
        "ar": "يشهد النظام البيئي الرقمي العربي تحولًا تاريخيًا. يستحق أكثر من 400 مليون متحدث باللغة العربية تجارب رقمية مصممة خصيصًا للغتهم وتراثهم الغني وفروقهم الثقافية الدقيقة - وليس ترجمات آلية فجة مقلوبة.\n\nمن خلال التصميم باحترام عميق للطباعة العربية (Typography)، وبيئة العمل الطبيعية من اليمين إلى اليسار (RTL)، والدلالات الثقافية، فأنت لا تقوم فقط بشحن التعليمات البرمجية - بل تقوم بنشاط بتأليف مستقبل العالم الرقمي العربي."
      },
      "callout": {
        "type": "note",
        "en": "Arabic digital experiences deserve native, culturally respectful craftsmanship. Build products that honor the language and elevate the community.",
        "ar": "تستحق التجارب الرقمية العربية حرفية أصلية تحترم الثقافة. قم ببناء منتجات تحترم اللغة وترتقي بالمجتمع."
      }
    }
  ]
}
