{
  "id": "navigation",
  "order": 16,
  "title": {
    "en": "Navigation",
    "ar": "التنقل"
  },
  "intro": {
    "en": "Navigation is the architectural spine of your application. Master visible tabs, hidden drawers, contextual links, cognitive limits, and Arabic RTL spatial conventions.",
    "ar": "يُعد التنقل بمثابة العمود الفقري المعماري لتطبيقك. أتقن استخدام علامات التبويب المرئية، والأدراج المخفية (Hidden drawers)، والروابط السياقية، والحدود المعرفية (Cognitive limits)، والاصطلاحات المكانية للغة العربية من اليمين إلى اليسار (RTL)."
  },
  "sections": [
    {
      "id": "three-navigation-types",
      "title": {
        "en": "The Three Navigation Paradigms",
        "ar": "الأنواع الثلاثة للتنقل"
      },
      "body": {
        "en": "Every digital product employs a synthesis of three core navigation patterns:\n\n1. **Visible Navigation:** Persistent tabs or header bars anchored in place. Zero-click discovery.\n2. **Hidden Navigation:** Off-canvas sidebars, hamburger drawers, and full-screen overlays. High capacity for deep site hierarchies, but requires an intentional click.\n3. **Contextual Navigation:** In-content hyperlinks, product tag chips, and inline breadcrumbs embedded directly within the flow of reading.",
        "ar": "أي تطبيق أو موقع بيستخدم توليفة من تلات أشكال أساسية للتنقل:\n\n1. **التنقل الظاهر (Visible):** تابات ثابتة ومفتوحة دايمًا قدام العين؛ أسرع وسيلة وصول بدون أي كليك إضافي.\n2. **التنقل المخفي (Hidden):** القوائم الجانبية المنسدلة (Hamburger Menu)؛ بتستوعب أقسام فرعية كتير لكنها بتتطلب نقرة إضافية.\n3. **التنقل السياقي (Contextual):** روابط ومسارات مدمجة جوه المحتوى نفسه (زي وسوم التاج، هاشتاجات، أو مسار الصفحات Breadcrumbs)."
      },
      "asset": {
        "file": "three-navigation-paradigms.png",
        "alt": {
          "en": "The three digital navigation paradigms: bottom tab bar, desktop top bar, and drawer sidebar",
          "ar": "الأنماط الثلاثة للتنقل الرقمي: شريط التبويبات السفلي، الشريط العلوي، والقائمة الجانبية"
        },
        "ratio": "16:9",
        "brief": "Architectural breakdown of three navigation patterns: (1) Mobile persistent 4-tab bottom bar for core destinations, (2) Desktop horizontal header with categorized dropdown menus, and (3) Collapsible sidebar drawer for deep, multi-tier utility tools."
      }
    },
    {
      "id": "visible-vs-hidden",
      "title": {
        "en": "Accessibility vs. Capacity: Hick's Law",
        "ar": "المعادلة: سهولة الوصول مقابل السعة"
      },
      "body": {
        "en": "The choice between visible and hidden navigation hinges on cognitive bandwidth:\n\n- **Visible Navigation Limits:** 3 to 5 tabs on mobile; up to 7 links on desktop. Exceeding this triggers **Hick’s Law**, increasing user decision time exponentially.\n- **When to Use Hidden:** If your product contains 8 or more top-level sections, place the core 4–5 in visible navigation and tuck secondary administration into a hidden drawer.\n\nNever overwhelm user short-term working memory.",
        "ar": "يعتمد الاختيار بين التنقل المرئي والمخفي على النطاق الترددي المعرفي (Cognitive bandwidth):\n\n- **حدود التنقل المرئي:** من 3 إلى 5 علامات تبويب على الهاتف المحمول؛ وما يصل إلى 7 روابط على سطح المكتب. تجاوز هذا يؤدي إلى تفعيل قانون هيك (Hick's Law)، مما يزيد من وقت اتخاذ القرار لدى المستخدم بشكل كبير.\n- **متى تستخدم المخفي:** إذا كان منتجك يحتوي على 8 أقسام علوية أو أكثر، فضع الأقسام الأربعة أو الخمسة الأساسية في التنقل المرئي وضع الإدارة الثانوية في درج مخفي.\n\nلا ترهق أبدًا الذاكرة العاملة قصيرة المدى للمستخدم."
      },
      "callout": {
        "type": "tip",
        "en": "Cap mobile bottom navigation at 5 items max to avoid cramped touch targets and cognitive paralysis.",
        "ar": "حدد الحد الأقصى للتنقل السفلي على الأجهزة المحمولة بـ 5 عناصر كحد أقصى لتجنب أهداف اللمس المزدحمة والشلل المعرفي."
      }
    },
    {
      "id": "mobile-tab-bar-design",
      "title": {
        "en": "Mobile Tab Bar Architecture",
        "ar": "تصميم شريط التابات للموبايل"
      },
      "body": {
        "en": "Constructing an ergonomic mobile bottom navigation bar:\n1. Create a full-width bottom container with **60–84 pt height**.\n2. Partition into equal slots (e.g. 4 or 5 columns).\n3. Center each icon and its supporting text label vertically within its slot.\n4. Dim inactive items to ~35%–50% opacity, while rendering the active item in high-contrast brand color.\n5. On buttonless modern smartphones (iPhone Home Indicator), leave generous bottom padding to prevent accidental OS gestures.",
        "ar": "بناء شريط تنقل سفلي مريح للهواتف المحمولة:\n1. قم بإنشاء حاوية سفلية كاملة العرض بارتفاع 60-84 نقطة.\n2. قسّمها إلى فتحات متساوية (مثلاً 4 أو 5 أعمدة).\n3. قم بتوسيط كل أيقونة وتسميتها النصية الداعمة رأسيًا داخل الفتحة الخاصة بها.\n4. قم بتعتيم العناصر غير النشطة إلى نسبة شفافية تتراوح بين 35% و50%، بينما يتم عرض العنصر النشط بلون علامة تجارية عالي التباين.\n5. على الهواتف الذكية الحديثة التي لا تحتوي على أزرار (مؤشر الصفحة الرئيسية لجهاز iPhone)، اترك حشوة (Padding) سفلية سخية لمنع إيماءات نظام التشغيل العرضية."
      },
      "asset": {
        "file": "tab-bar-anatomy.png",
        "alt": {
          "en": "Mobile tab bar layout with home indicator safe area and active states",
          "ar": "تخطيط شريط علامات تبويب الجوال مع المنطقة الآمنة لمؤشر الصفحة الرئيسية والحالات النشطة"
        },
        "ratio": "16:9",
        "brief": "A mobile screen bottom frame showing 4 navigation tabs with the home tab highlighted in brand accent, clear inactive icons, and safe area margin above the home bar."
      }
    },
    {
      "id": "desktop-nav-and-sidebar",
      "title": {
        "en": "Desktop Headers & Drawer Sidebars",
        "ar": "نافيجيشن الديسكتوب والسايدبار الجانبي"
      },
      "body": {
        "en": "On desktop, navigation tabs live in the header. If you include an action button (e.g. \"Login\" or \"Get Started\"), **place it at the very end of the row**. Never insert a heavy button into the middle of navigation links where it interrupts reading flow.\n\n**The Slide-Out Sidebar:** When invoking a hidden menu, darken the background with a 60%–70% opacity backdrop scrim to focus attention entirely on the drawer.",
        "ar": "على سطح المكتب، توجد علامات تبويب التنقل في العنوان. إذا قمت بتضمين زر إجراء (مثل \"تسجيل الدخول\" أو \"البدء\")، فضعه في نهاية الصف تمامًا. لا تقم أبدًا بإدراج زر ثقيل في منتصف روابط التنقل حيث يؤدي إلى مقاطعة تدفق القراءة.\n\n**الشريط الجانبي المنزلق:** عند استدعاء قائمة مخفية، قم بتعتيم الخلفية بنسبة شفافية 60٪ - 70٪ لتركيز الانتباه بالكامل على الدرج."
      }
    },
    {
      "id": "rtl-navigation-rules",
      "title": {
        "en": "RTL Navigation & Arabic Alignment",
        "ar": "قواعد التنقل في الواجهات العربية"
      },
      "body": {
        "en": "In Arabic interfaces, visual navigation flips horizontally:\n\n- **Tab Bar Ordering:** Runs strictly from right to left. Tab 1 (\"Home\") must sit at the far **Right**, not the left.\n- **Sidebar Ingress:** The drawer must slide in from the **Right** edge. A sidebar opening from the left in an Arabic app feels jarring and broken.",
        "ar": "في الواجهات العربية، ينقلب التنقل المرئي أفقيًا:\n\n- **ترتيب شريط علامات التبويب:** يمتد بشكل صارم من اليمين إلى اليسار. يجب أن تقع علامة التبويب 1 (\"الرئيسية\") في أقصى اليمين، وليس اليسار.\n- **دخول الشريط الجانبي:** يجب أن ينزلق الدرج للداخل من الحافة اليمنى. الشريط الجانبي الذي يفتح من اليسار في تطبيق عربي يبدو متنافرًا ومعطلًا."
      },
      "callout": {
        "type": "note",
        "en": "Always anchor primary Arabic navigation to the right edge. Arabic users visually initiate spatial scanning from right to left.",
        "ar": "ثبّت عناصر التنقل الرئيسية في الواجهات العربية ناحية اليمين؛ العين العربية تبدأ المسح البصري تلقائياً من أقصى اليمين."
      },
      "asset": {
        "file": "rtl-navigation-flipping.png",
        "alt": {
          "en": "RTL navigation horizontal flipping rules for Arabic interface design",
          "ar": "قواعد عكس اتجاه التنقل للواجهات العربية من اليمين إلى اليسار"
        },
        "ratio": "16:9",
        "brief": "Two mobile app headers and tab bars comparing LTR vs RTL: Annotations highlight what flips (Back arrow points right, tab order starts from right, chevron disclosure indicators flip) versus what never flips (media scrubbers, phone numbers, Western brand logos)."
      }
    }
  ]
}
